{
  "assurance_standard_versions": [
    2
  ],
  "canonical_repository": "https://github.com/bshirley7/continuity-skills",
  "files": {
    "CONTRIBUTING.md": "259668d84f9c29a798161a799287575333c8fedf68d0e5b10d3367c0401bc688",
    "README.md": "a35158b3032c3df0cd14be22b181a9a7f7ae522b79749140b287b74282c3018b",
    "SUITE.md": "5e5318bd4e69aba1209085827f9a2a0f91a19ccd2d5b6f890504b676cc1a01eb",
    "VERSION": "93f893b9b51cd2ee055332a64d4656e5bbbb652788acbaeaa7d1a6b32099d23f",
    "automation/default-dispatch.md": "fd857f09e54ad406538db5478164965414cfbbb33e36c996a843f5057308d3de",
    "automation/morning-report.md": "15c8fb17520f819474f7af008c880a993ed0181641c6bebf4051e96be6cb0315",
    "automation/nightly-review.md": "d2c853dac7fa78e930d68ab6b685bf602f5e434a4d258f5e9d483c6f86d76b67",
    "automation/portfolio-supervisor.md": "ae3ec7fcdcb77c8cb7cb690a9eaf0904afa9f5fefb3f6f89ccc926ee9d7ad8cb",
    "automation/provider-adapter-contract.md": "9de13914d58f1d9864c2bd2438a70a208a3f0606b4b42de2b9158e7fb68ffe5d",
    "bin/continuity": "7760530821b3687c3eb243126e576a46130ddef2a79d5cceec9b2c7aa80ba700",
    "collections/core.json": "3fbcbdd5ac1bbe19f26e0599af52253da2675f8362daa620e831d3699cd816a9",
    "collections/design.json": "8d2b31bbcd552bdcf52eedb7f01b4cb4626111276c6574ee4983057b7aa6838d",
    "collections/projects.json": "86d9d03c8521b3f8a0c431793e597e4d1047ce3382a49d6d38447a9b1fe4067b",
    "docs/assets/continuity-wordmark.svg": "2139dc477423fd2c4e05ee99e1d3e6b54bed8f58255f2a6ff0e044fc1d6c87e5",
    "docs/install-and-daily-use.md": "5cb04d3b7a5ad294880ee9a881bcd63bcfbefe09f3d62850649219a24e5bd6c7",
    "docs/operating-workflow.md": "2854e005cfc1b8d1fcc3cce57112e985bec93af5c6e7bb4eb106950e91e91c79",
    "docs/production-pilot.md": "e57a3a2229ba2c249aad3487732626c9a556b667c66585c5a5ca6891e7df80eb",
    "docs/quickstart.md": "012751912b75cc77c9336f33fc6697393b11b3a2ad6e8271d77bde5f16bd389a",
    "docs/releases-updates-and-recovery.md": "25551adf4f5d78b636ea78bda52d0cf9908bc470abe6eefc11de3cb7a7c14fc5",
    "installer/install.py": "99dce47f5b94700908a986e2087f91c3a8e5de974e585fc7c8a76f7c797ffc99",
    "lib/design.py": "570b4ac54e3cd5b6e3945bd407e02fe5ffd0b1f42f207dfb3d8a6791ed93c803",
    "lib/github_projects.py": "d7fe4769fdd05be99f4ecb23bcffab7597a5e99c281c0db9710300df76a59da5",
    "lib/roadmap.py": "09b728436668139569d225332fab0080cf83f4c715f44d2fff01d2d0de233d4c",
    "lib/runtime.py": "7d2daf29a803da0ea4247da479e56b842e278a665265d8e9bdca921603b19354",
    "lib/shared_notes.py": "efba9024984113d46fe61afef82fe3554c0a4f365e6ed22260cd738073633c32",
    "references/continuity-contract.md": "a56e4fcf5964b5206c892a5d5bb59a8f200e00ea0441a468debb06e47def06fa",
    "references/decision-lenses.md": "f37413659f29f1aeec68c1944cd04daf087c50093feefe35bc372f27c9115722",
    "references/development-assurance-standard.md": "a0fc2a2ff31f338caf56b6aa75c5d6153fea5ea448012053ef1385c0b9bd7221",
    "references/output-quality-rubrics.md": "3372154bde87ef8e7dad6a60bc42bff1229bc9028a4d02497864010007a4e335",
    "references/planning-patterns.md": "1079c8172ca3d90db35303ed1889cd5746d1c3b05f3504e01861f8c7bee95da7",
    "references/testing-and-merge-standard.md": "def24f66e6a10c17722cc20315c9e539691ddd567dc5b0c8aeea7ccf6554743c",
    "references/worked-lifecycle-example.md": "12906b02b53772646b816ffdd023e9ea5b346d1d4d60d80a1321733653611a86",
    "references/workflow-handoffs.md": "5b7ab84e75bf2aeea05bea0cd9ac5f6fad6bc978fd117a6983f83436a9343745",
    "roadmap-ui/app.js": "98ce9358cd8c74638f68f88fbb38f99351da8bd3762130f79fb25253b5ac6a74",
    "roadmap-ui/index.html": "1e2a18921b8c314d022675a53ea65050bfcb62700cc5305a05b704c8632e7335",
    "roadmap-ui/styles.css": "7eeb84d87567300d3fc572c23a02c344c72ea94341a4c0b2b70b77022ebe153b",
    "schemas/approval-receipt.schema.json": "1f2d3dd7227d46b0bece8ddb0f79e4f35d19cff33f1ca7927f409491da294216",
    "schemas/backup-manifest.schema.json": "94c250004b79591e978f12fe3f77348d13c57aa599ea7b7d68d7d57ef67c6de5",
    "schemas/capture.schema.json": "051371a6508df4ec67d168457b370f24823a4ecf6ddd95ad078e015427f53370",
    "schemas/codex-automation.schema.json": "eee06f5b7aa960ac7beb732a94cf9bb63579683fecb8fceb23c1042873cbcbd6",
    "schemas/collection.schema.json": "cba90d3b0550359ad76fd76872ab2bc654d54e794d08881eb0da9d14d27d4241",
    "schemas/compliance.schema.json": "865e27cc15db487c091b2c273aadd34bc1151663d6ea45a5614ffc0f76888fd4",
    "schemas/decision-map.schema.json": "e2af22bf6de940246039c252962989030d0cd5d55be28d021aae758222459026",
    "schemas/delivery-slice.schema.json": "13502009e904951095837df35d8e245d4dd34f73a61be8de1ef5d8964402d886",
    "schemas/design-catalog.schema.json": "22c13c9a6f11baf89429605f51c976c4f5529261488fde51ca3968dc28f19a8d",
    "schemas/design-input.schema.json": "4c415dcad0f53dce0a3e0cb6e67521a8ca450604edc9a66abc54220f8cc0bee3",
    "schemas/design-record.schema.json": "30965cfa126f48ec20766178b70627187a4734dc662479684d95f19a0a49e3bc",
    "schemas/github-projects-approval.schema.json": "a38558aed97db30b3c4318af776dfa0a3c4683af8c65e8b83e2c754b760e248c",
    "schemas/github-projects-bootstrap-plan.schema.json": "4b261780a2a3619132e71d8537eafef44f3c7abd53d601501b82764872cf691b",
    "schemas/github-projects-export-plan.schema.json": "c5c9e8ef5c3f1fe13a70c4132d457d36d0e21e29fc2dedb92bb8b147dd2ad80a",
    "schemas/github-projects-settings.schema.json": "a459316b79e3952b11abe5450cd2e6cd7ab9314d1c5dabf92a9aa41ac8256e34",
    "schemas/goal.schema.json": "f5d19e4662e3c9318b0f040177789ad71a48a457f2c810e4503c4b00b736115c",
    "schemas/install-manifest.schema.json": "7c40c67f6aa3675706a4ab24976082ee50264e0c1a1b3ed8f53fa5c9564f10d1",
    "schemas/machine-test-run.schema.json": "76f052a645d27836b8f9ff2b1fc167063b2252975e38b1352ec1042661d33a53",
    "schemas/merge-assessment.schema.json": "8c86deb0fbc1869e6adb6cbed25452d8455da09a476cb79d7e8dc6868583fa74",
    "schemas/merge-authorization.schema.json": "6be4241b5263d36d65b45cdb63e94d261428f9365b2202499d94c26c73250de8",
    "schemas/morning-report.schema.json": "f84048d7d4cc1a29ee49b28b26b6062fab64c3ae80d2254bade08fec2e25b299",
    "schemas/note-disposition.schema.json": "a1d91062228c29fbb1837e4c428114151e2e8963ff9ba516e3dbdf4fd5c32b6f",
    "schemas/note-lifecycle.schema.json": "2a5ff78fe0c1db9f9997869c23bd32f62de576019291aebc1e9bd055d10d46b7",
    "schemas/packet-approval.schema.json": "5413d31fc2a7acd419c361140a2ee9c170cd0968afba19eef2fa0de449194f9b",
    "schemas/portfolio-report.schema.json": "de5cc0f9e452af320c7e4fcb97281fad1b4e7eb30aecea87e414537ac440ce8b",
    "schemas/project-behavior.schema.json": "6f9c28caeb30d9f0f809ee56d5a969c9167823f1bcffbf5bd4aeb2543ce2b037",
    "schemas/project-config.schema.json": "7be5036816856349c884d5d245966a5702eeb21f8b421ec36e4e0c6443465f93",
    "schemas/project-manifest.schema.json": "5a2594b01ff38df62977c9b901e7bed5ff68428f5e8eb73145e13179450be833",
    "schemas/release-manifest.schema.json": "87daf4d738595cb5b840c1dd8a3c92f4e1182d88c4f835ce486826f40408ccc3",
    "schemas/remote-lease.schema.json": "4351c73879b9447f951cc7fe5752faf9fcf2126db3754ecd0c91c9884b9a489a",
    "schemas/roadmap-entry.schema.json": "cb2e2e1696c732300ce83aec3902271f478ab04bdaace690f276a330325cb794",
    "schemas/roadmap-impact.schema.json": "015d0f7b3eb8d8ad186ef73883975bdbc29a464d521d389d24575e2b9021643c",
    "schemas/roadmap-settings.schema.json": "efecd1deed8b3ec28cb451e340d8a9352be48703c89db7d5c877ca57f3cfd9b1",
    "schemas/scheduler-due-action.schema.json": "b6ca4d67367000ffc17b1acef58166394d086ad6c98040208c552575132bc8bc",
    "schemas/scheduler-handoff.schema.json": "02c391f5e3562b5cae8c6a1fc1c5148060dadaa514a2c1feb6df16a87018b32d",
    "schemas/scheduler-registration.schema.json": "3effb36fd2daf63cafadf7d1857024b572c694545ded2e793abce0a5897f258d",
    "schemas/scheduler-run.schema.json": "0b709c47df1c35a9001b83dabdb64750e5b00a544d631be7eac1599607baba93",
    "schemas/scheduler-settings.schema.json": "2a3e0e18de95f886a37518bc85f1d50fe2059a3a3cee065d1f37a62c662d48c9",
    "schemas/shared-note-packet.schema.json": "ac954300ccf1370fc785ffab17e4021701d88f36102ef2ac08a948539c28b627",
    "schemas/test-report.schema.json": "954e573e3cfffe717a9806318afd112a1076be155d535ac2b19921dda4236cc2",
    "schemas/triage-brief.schema.json": "49e36f349d0f2203632dea4e8dcefca2ed2a4c78a8ed2feba98b30eb1527b87f",
    "schemas/user-defaults.schema.json": "f7faae1c89c58adc76f68f13484813ead8235f3f0a1276fecd70e23800145484",
    "schemas/workflow-handoff.schema.json": "98a530256446b1b75d016b01e6bc82924d50acc9f31fe8849424ea3d271c1e9b",
    "schemas/workflow-status.schema.json": "4c04266852a1d586315dfdcc3631be7a6e3e2e08339fc00e7a6dd36140cc96fb",
    "scripts/build_release_manifest.py": "6cc1644c2f71249f76ed36c5c2deb4e555c51ade2f183c3cb24de96fcc591e86",
    "scripts/validate_design_boundary.py": "b08213c943125b30d499fa18b316d03f117193b444c38d753d9ffc3c322e62c0",
    "scripts/validate_skills.py": "780f9cf5af21e907b0cf2d773e22970052afc543487463793d1e57c1fe2b5864",
    "skills/continuity-capture/SKILL.md": "a2a66e707846f8c45bb339c4cddd75490c24da12ce749740cafe974921321375",
    "skills/continuity-capture/agents/openai.yaml": "0728344f4069d1c64e67c72634697c67a35f5d95d2ca7da84f646bf405952c60",
    "skills/continuity-capture/references/capture-examples.md": "d85ce194b128beb55cee0410ec976791a059f5bb563fbd9d002fbc1c2c6a7aff",
    "skills/continuity-capture/references/capture-input.example.json": "d2956e601ded69e90dbe8ccc3cba9c596b6dd58981dedf01fd281ac76c9b3ef3",
    "skills/continuity-capture/references/document-capture.md": "6174f7c06f876db76d64f016850022c727780229ca9e0bb73a5fa9a703607f9f",
    "skills/continuity-capture/references/feature-request-capture-input.example.json": "53e6555605fe4038087c24e62d5baec9b61271ccd451cd7824e87854f1c9c170",
    "skills/continuity-capture/references/feature-request-source.example.txt": "cd0c16dbe2bcd508efbc728056684165b885a9634004cb7ea1fa1ab305b96290",